"data.list.id","title","created","url","country"
"560405","Myanmar: Preparing for peace",2013-03-04,"http://reliefweb.int/node/560405","All"
"84449","UNTAET Daily Briefing 10 Aug 2001",2001-08-10,"http://reliefweb.int/node/84449","All"
"471357","Faltan 80 muros para proteger a las zonas que están en riesgo",2012-01-19,"http://reliefweb.int/node/471357","All"
"267270","Mercy Corps sends emergency supplies to Myanmar and China",2008-05-22,"http://reliefweb.int/node/267270","All"
"299628","MAP responds to cholera crisis in Zimbabwe",2009-03-03,"http://reliefweb.int/node/299628","All"
"289031","Europe hesitant, divided over force for east DR Congo",2008-12-01,"http://reliefweb.int/node/289031","All"
"77978","Pakistan reopens Afghan border after Taliban apology",2001-03-14,"http://reliefweb.int/node/77978","All"
"325539","Africa weekly emergency situation update Vol. 2, No. 37-38",2009-09-21,"http://reliefweb.int/node/325539","All"
"254595","Philippines: Manila warns against fresh wave of militant attacks",2008-01-17,"http://reliefweb.int/node/254595","All"
"221136","The African Peace and Security Council: reconstruction efforts must be supported in the Central African Republic",2006-12-11,"http://reliefweb.int/node/221136","All"
"308721","World Vision initiative helps 2000 children get 'back to school' in Sri Lanka's displacement camps",2009-05-11,"http://reliefweb.int/node/308721","All"
"205380","Chad withdraws from AU peace talks on Darfur",2006-04-16,"http://reliefweb.int/node/205380","All"
"496387","First ever UNDP Human Development Report focusing on Africa and ‘a Food Secure Future’ to be
launched by UNDP Administrator Helen Clark and Kenyan President Mwai Kibaki",2012-05-14,"http://reliefweb.int/node/496387","All"
"583790","On World Refugee Day, Needs Of Displaced Everywhere Must Be Remembered",2013-06-19,"http://reliefweb.int/node/583790","All"
"288290","Church delivers lifesaving aid in DR Congo",2008-11-24,"http://reliefweb.int/node/288290","All"
"442372","Situation Report #2 Tropical Depression Harvey leaves Belize as Tropical Storm Irene passes south of the Lesser Antilles and threatens Haiti (as of Sunday August 21, 2011 at 5:00 p.m. EST)",2011-08-22,"http://reliefweb.int/node/442372","All"
