"data.list.id","title","created","url","country"
"264855","Questions and answers about the Myanmar cyclone",2008-05-09,"http://reliefweb.int/node/264855","All"
"163709"," Congo: Government starts to count soldiers",2005-01-17,"http://reliefweb.int/node/163709","All"
"393178","Japan: Offer of Assistance from Foreign Countries and Regions (Tohoku - Pacific Ocean Earthquake): update March 22, 2011",2011-03-22,"http://reliefweb.int/node/393178","All"
"98799","West Bank/Gaza Strip health update 4 Apr 2002",2002-04-04,"http://reliefweb.int/node/98799","All"
"216518","Haitian leaders want to end human rights abuses, says top UN rights official",2006-10-19,"http://reliefweb.int/node/216518","All"
"174641","Soglo : ''La communauté internationale doit soutenir le Togo''",2005-05-26,"http://reliefweb.int/node/174641","All"
"214541","Relief Bulletin: Weekly Humanitarian Highlights in Ethiopia 21 Sep 2006",2006-09-21,"http://reliefweb.int/node/214541","All"
"491102","Ecuador: Provincias estado de excepción (18 de abril 2012)",2012-04-19,"http://reliefweb.int/node/491102","All"
"406746","Haïti - inondations Rapport de situation No. 1, 7 Juin 2011",2011-06-08,"http://reliefweb.int/node/406746","All"
"213871","Sudan: New estimate says 100s of thousands dead in Darfur",2006-09-15,"http://reliefweb.int/node/213871","All"
"554689","At Brussels conference, UN stresses need for dual-track approach to stabilize Mali",2013-02-05,"http://reliefweb.int/node/554689","All"
"310499","Pakistan: Humanitarian Assistance to Internally Displaced People Information Bulletin No. 1",2009-05-26,"http://reliefweb.int/node/310499","All"
"322309","Central African Republic: News bulletin No. 122, 17-24 Aug 2009",2009-08-24,"http://reliefweb.int/node/322309","All"
"59523","UNTAET Daily Briefing 15 Feb 2000",2000-02-15,"http://reliefweb.int/node/59523","All"
"413786","India Flood Situation 05 Aug 2005",2005-08-05,"http://reliefweb.int/node/413786","All"
"410764","Sudan: UNJLC bulletin 24/2004",2004-08-25,"http://reliefweb.int/node/410764","All"
"53386","Moscow Authorities falsely charging Ethnic Chechens",1999-09-30,"http://reliefweb.int/node/53386","All"
"102397","Injured survivors recount militia massacre in East Timor",2002-05-30,"http://reliefweb.int/node/102397","All"
"214709","UNIFIL: Helping people in South Lebanon",2006-09-27,"http://reliefweb.int/node/214709","All"
"600112","Learning From the Urban Transitional Shelter Response in Haiti: Lessons From CRS' 2010–2012 Post-earthquake Activities",2012-04-16,"http://reliefweb.int/node/600112","All"
"25468","Girls Speak: A New Voice In Global Development",2010-07-01,"http://reliefweb.int/node/25468","All"
"487243","7,000 flee after government forces raze villages in North Darfur",2012-04-02,"http://reliefweb.int/node/487243","All"
"602036","Still no direct talks in DR Congo peace bid",2013-09-13,"http://reliefweb.int/node/602036","All"
"369988","Immigration surging in Cameroon as farmers and fishermen desert shrinking Lake Chad",2010-10-05,"http://reliefweb.int/node/369988","All"
"150003","Freak weather kills 41 people, injures 150 across China",2004-07-07,"http://reliefweb.int/node/150003","All"
"142266","Annan wants 350 UN police in Ivory Coast",2004-02-12,"http://reliefweb.int/node/142266","All"
"483500","Unplanned Explosions at Munitions Sites (UEMS) page - Updated",2012-03-16,"http://reliefweb.int/node/483500","All"
"125462","Field Exchange Mar 2003: Policy lessons from Malawi",2003-03-31,"http://reliefweb.int/node/125462","All"
"381006","Sudan opposition threatens protests over price hikes",2011-01-16,"http://reliefweb.int/node/381006","All"
"56048","Informe del estado del volcan Tungurahua 18 Nov 1999",1999-11-18,"http://reliefweb.int/node/56048","All"
"197868","Sri Lanka: Tamil Tigers must stop violent attacks, State's Burns says",2006-01-23,"http://reliefweb.int/node/197868","All"
"535171","Dr. Ali El-Haj: ‘Connection between bombings and fever outbreak’",2012-11-05,"http://reliefweb.int/node/535171","All"
"234343","The United States government's contribution to UNRWA Flash Appeal for emergency needs of Palestinian refugees in North Lebanon",2007-06-05,"http://reliefweb.int/node/234343","All"
"277642","Togo : la pluie cesse mais les dégâts sont immenses, le témoignage d'un missionnaire",2008-08-22,"http://reliefweb.int/node/277642","All"
"11748","Sri Lanka: Number of Families Affected by Floods, 27th November 2008 - 10:00 hrs",2008-11-27,"http://reliefweb.int/node/11748","All"
"156411","Too early to judge Afghan elections",2004-10-10,"http://reliefweb.int/node/156411","All"
"222704","Gunilla Carlsson on humanitarian support to Somalia",2006-12-28,"http://reliefweb.int/node/222704","All"
"442497","Security Conditions at Tripoli Port Likely to Delay Docking of IOM Chartered Boat",2011-08-23,"http://reliefweb.int/node/442497","All"
"365338","Kenyan scientists push for cleaner water to curb climate-linked disease",2010-08-24,"http://reliefweb.int/node/365338","All"
"125300","Sierra Leone: War-affected women in Freetown get help",2003-05-06,"http://reliefweb.int/node/125300","All"
"252759","Nepal: NGO helps children traumatised by conflict",2007-12-13,"http://reliefweb.int/node/252759","All"
"211257","USIP releases report on Afghanistan's neighbors",2006-06-14,"http://reliefweb.int/node/211257","All"
"561980","Defensa Civil de Chuquisaca entrega alimentos a familias damnificadas de Sud Cinti",2013-03-12,"http://reliefweb.int/node/561980","All"
"96758","DR Congo, Ethiopia, Nigeria, Pakistan, the Republic of Congo: Polio eradication campaign appeal No. 07/02",2002-03-01,"http://reliefweb.int/node/96758","All"
"243821","Floods in Ghana: concerns rise about the sanitary and food security situation for affected populations",2007-09-18,"http://reliefweb.int/node/243821","All"
"621403","Ethiopia - Health situation (ECHO Daily Flash, 6/12/2013)",2013-12-06,"http://reliefweb.int/node/621403","All"
"289343","UNICEF calls on parties to stop recruiting child soldiers in DRC",2008-12-02,"http://reliefweb.int/node/289343","All"
"204777","Sri Lanka army says rebel ambush kills 7, Canada acts",2006-04-10,"http://reliefweb.int/node/204777","All"
"414098","Sahelian West Africa - Humanitarian Emergency Fact Sheet #6 (FY) 2005",2005-09-09,"http://reliefweb.int/node/414098","All"
"55720","République Centrafricaine: Liste des membres du nouveau gouvernement",1999-11-09,"http://reliefweb.int/node/55720","All"
"583176","Speech of Commissioner Andris Piebalgs on behalf of EU High Representative Catherine Ashton on Partnership and cooperation agreement with Afghanistan",2013-06-17,"http://reliefweb.int/node/583176","All"
"306141","México: Sesión de preguntas y respuesta en la conferencia conjunta de los Secretarios de SALUD, SEP, SE Y STPS",2009-04-26,"http://reliefweb.int/node/306141","All"
"329278","RD Congo/Walendu Bindi : situation humanitaire déplorable pour plus de 17 mille déplacés",2009-10-16,"http://reliefweb.int/node/329278","All"
"332753","Somalia: Saudi livestock move boosts Somaliland economy",2009-11-10,"http://reliefweb.int/node/332753","All"
"432936","Floods overwhelm Ethiopia, hundreds dead",2006-08-17,"http://reliefweb.int/node/432936","All"
"433661","Lebanon: Returnee situation",2006-08-25,"http://reliefweb.int/node/433661","All"
"224704","Malaysia: Floods hit Sarawak, other states improving",2007-01-23,"http://reliefweb.int/node/224704","All"
"577837","How to Save a Fish … a Lake and a People",2013-05-22,"http://reliefweb.int/node/577837","All"
"375669","Israel troops get suspended sentence on Gaza abuse ",2010-11-21,"http://reliefweb.int/node/375669","All"
"372805","Pakistan: HHRD Flood Response Weekly Updates October 29, 2010",2010-10-29,"http://reliefweb.int/node/372805","All"
"146062","WFP Emergency Report No. 17 of 2004",2004-04-23,"http://reliefweb.int/node/146062","All"
"139749","Church leaders call for renewed efforts for dialogue in the Ugandan war",2003-12-25,"http://reliefweb.int/node/139749","All"
"119746","Oxfam International: Southern Africa food deficit crisis Update 7",2003-02-07,"http://reliefweb.int/node/119746","All"
"52250","China Floods Displace 5.5 Million People, Create Poverty Trap",1999-09-10,"http://reliefweb.int/node/52250","All"
"463204","Raise of homeless children numbers in Nyala",2011-12-05,"http://reliefweb.int/node/463204","All"
"359230","Guinea: Upcoming Election Significant, Challenging",2010-06-25,"http://reliefweb.int/node/359230","All"
"100573","Eight abducted Ugandan children flown home from Sudan",2002-05-01,"http://reliefweb.int/node/100573","All"
"189584","Israel keeps grip on Gaza despite pullout: envoy",2005-10-24,"http://reliefweb.int/node/189584","All"
"58339","IRIN-CEA Weekly Round-up 2 covering the period 08-14 Jan 2000",2000-01-14,"http://reliefweb.int/node/58339","All"
"367790","ECC: Elections not about fraud but about empowering Afghan people",2010-09-15,"http://reliefweb.int/node/367790","All"
"373560","Honduras: Alerta amarilla por frente frío",2010-11-04,"http://reliefweb.int/node/373560","All"
"605623","Investigate Deadly Shooting in Papua",2013-09-30,"http://reliefweb.int/node/605623","All"
"486596","103 familias cuencanas recibirán apoyo para reubicación",2012-03-30,"http://reliefweb.int/node/486596","All"
"108570","Iran - Qazvin, Zanjan, and Hamedan: Where psychological support is a need",2002-08-31,"http://reliefweb.int/node/108570","All"
"78559","Burundi: Between hope and fear",2001-03-21,"http://reliefweb.int/node/78559","All"
"398201","En Timbiquí, Cauca, Acción Social acompana retorno de familias desplazadas",2011-04-21,"http://reliefweb.int/node/398201","All"
"339878","Kenya: Floods Situation Report No. 3, 12 Jan 2010",2010-01-12,"http://reliefweb.int/node/339878","All"
"595575","Market Assessment: Market Component of Cash & Voucher Feasibility Study, July 2013",2013-08-14,"http://reliefweb.int/node/595575","All"
"266872","Iraqi army seizes Sadr's Baghdad bastion ",2008-05-21,"http://reliefweb.int/node/266872","All"
"219932","Mali : Situation par indicateurs en juillet 2006",2006-07-31,"http://reliefweb.int/node/219932","All"
"439828","Le PNUD soutient la révision du fichier électoral en RDC",2011-08-08,"http://reliefweb.int/node/439828","All"
"201570","Iraq: Kurdish politician discusses political standoff",2006-03-02,"http://reliefweb.int/node/201570","All"
"329799","More asylum seekers will come unless push factors tackled",2009-10-19,"http://reliefweb.int/node/329799","All"
"443837","REDLAC Weekly Note on Emergencies Latin America & the Caribbean, Year 4 – Volume 21 - 29 August, 2011",2011-08-30,"http://reliefweb.int/node/443837","All"
"424264","US House to warn Palestinians on statehood bid",2011-07-07,"http://reliefweb.int/node/424264","All"
"470887","Christian aid assists civilians fleeing violence in South Sudan",2012-01-17,"http://reliefweb.int/node/470887","All"
"261486","Tchad : Première attaque rebelle depuis février",2008-04-02,"http://reliefweb.int/node/261486","All"
"409504","Report on the human rights situation in Colombia (E/CN.4/2003/13)",2003-02-24,"http://reliefweb.int/node/409504","All"
"97576","UN Security Council Resolution 1270 (1999) on the Situation in Sierra Leone",1999-10-22,"http://reliefweb.int/node/97576","All"
"244876","Le conflit oublié en République centrafricaine a déraciné plus de 290 000 personnes",2007-09-26,"http://reliefweb.int/node/244876","All"
"621546","Floods in Somalia (as of December 4, 2013)",2013-12-06,"http://reliefweb.int/node/621546","All"
"345389","COMMISSION DECISION of on the approval and financing of a Global Plan for humanitarian Actions in the Middle East from the general budget of the European Union ECHO/-ME/BUD/2010/01000",2010-02-11,"http://reliefweb.int/node/345389","All"
"114939","CWS Emergency Appeal: Ethiopia drought",2002-11-27,"http://reliefweb.int/node/114939","All"
"180209","Sudan: Medair starts reproductive health-care programme in West Darfur",2005-07-28,"http://reliefweb.int/node/180209","All"
"15193","Republic Democratique du Congo : Province du Nord Kivu - Situation du Volcan Nyamulagira au 06/01/2010",2010-01-06,"http://reliefweb.int/node/15193","All"
"612783","Haiti's rebuilding continues, one year after Hurricane Sandy",2013-10-31,"http://reliefweb.int/node/612783","All"
"99809","Yugoslav president urges support for Serbia-Montenegro union",2002-04-18,"http://reliefweb.int/node/99809","All"
"165907","Kenya: UNHCR strengthens mechanisms to curb violence in refugee camps",2005-02-11,"http://reliefweb.int/node/165907","All"
"203243","Sri Lanka: Night-time MRE in Vanni region",2005-10-04,"http://reliefweb.int/node/203243","All"
"169171","Burmese Chin refugees in Malaysia",2005-03-15,"http://reliefweb.int/node/169171","All"
"284554","India: 'Bihar flood destroyed crops worth Rs 800 crore' ",2008-10-14,"http://reliefweb.int/node/284554","All"
"190476","Sixth meeting of the heads of United Nations peace missions in West Africa held in Monrovia, Liberia, 27 Oct 2005",2005-10-27,"http://reliefweb.int/node/190476","All"
"275283","Uganda: Drought early warning system for Nakapiripirit district - monthly drought bulletin for Jun 2008",2008-08-05,"http://reliefweb.int/node/275283","All"
"103501","Red Cross supports mass vaccination to rid Kenya of measles scourge",2002-06-17,"http://reliefweb.int/node/103501","All"
"441421","At least 10 dead, Syria makes sweeping arrests",2011-08-17,"http://reliefweb.int/node/441421","All"
"521051","Haiti: Damage, Needs and Responses (as of 27 August 2012)",2012-08-29,"http://reliefweb.int/node/521051","All"
"152103","More locust swarms are invading Sahel countries",2004-07-27,"http://reliefweb.int/node/152103","All"
"354502","BURKINA FASO: Feed the cows",2010-05-13,"http://reliefweb.int/node/354502","All"
"379819","Bahrain to build health clinic and library in Gaza",2011-01-05,"http://reliefweb.int/node/379819","All"
"500061","Madagascar: Tropical storms DREF operation n° MDRMG008 - Emergency appeal operation update",2012-05-30,"http://reliefweb.int/node/500061","All"
"97319","Abkhazia: Letter from Georgia to the UN Security Council (S/2002/220)",2002-03-01,"http://reliefweb.int/node/97319","All"
"59185","IRIN Update 649 of events in West Africa",2000-02-07,"http://reliefweb.int/node/59185","All"
"351255","AmeriCares Delivers New X-Ray Machine to Haiti",2010-04-13,"http://reliefweb.int/node/351255","All"
"407744","UNMEE MACC Update 25 May 2001",2001-05-25,"http://reliefweb.int/node/407744","All"
"181800","Sudan: UN envoy continues talks with southern rebel leaders, civil society",2005-08-15,"http://reliefweb.int/node/181800","All"
"599639","Over 120,000 affected by SW China quake",2013-09-03,"http://reliefweb.int/node/599639","All"
"277887","Mekong river water levels 25 Aug 2008",2008-08-25,"http://reliefweb.int/node/277887","All"
"229530","Supplementary Appeal: Protection and assistance to IDPs in the Democratic Republic of the Congo",2007-02-13,"http://reliefweb.int/node/229530","All"
"7595","Central African Republic: Offices of humanitarian organizations",2007-08-07,"http://reliefweb.int/node/7595","All"
"102217","Southern Africa: Food insecurity appeal No 12/02 operations update No. 1",2002-05-28,"http://reliefweb.int/node/102217","All"
"201974","Georgia: Humanitarian and development update Feb 2006",2006-02-28,"http://reliefweb.int/node/201974","All"
"554959","UN official says ""flying cameras"" will improve peacekeeping in DRC",2013-02-06,"http://reliefweb.int/node/554959","All"
"140056","80 US doctors, rescue workers headed for Bam: official",2003-12-30,"http://reliefweb.int/node/140056","All"
"195826","Zimbabweans resigned to yet another year of misery and suffering",2005-12-28,"http://reliefweb.int/node/195826","All"
"118999","Malawi: Newly launched atlas details social indicators in Malawi",2003-02-10,"http://reliefweb.int/node/118999","All"
"262068","IFFIm raises money for immunisation",2008-04-09,"http://reliefweb.int/node/262068","All"
"177938","Israel: New terminals at checkpoints in West Bank",2005-07-06,"http://reliefweb.int/node/177938","All"
"135053","UNHCR briefing notes: Iraq",2003-09-29,"http://reliefweb.int/node/135053","All"
"74603","Patten to discuss US hostage, Chechnya aid with Russian FM",2001-01-19,"http://reliefweb.int/node/74603","All"
"189585","South Asia earthquake: ICRC - Bulletin No. 15",2005-10-23,"http://reliefweb.int/node/189585","All"
"359691","Situation report: Floods in Romania - June 2010",2010-06-30,"http://reliefweb.int/node/359691","All"
"235837","Pakistanis, Indians, evacuate after deadly storms",2007-06-25,"http://reliefweb.int/node/235837","All"
"150467","Tajikistan: Floods Information Bulletin No. 2/2004",2004-07-19,"http://reliefweb.int/node/150467","All"
"455527","Operation Blessing International responding to deadly earthquake in eastern Turkey",2011-10-26,"http://reliefweb.int/node/455527","All"
"411632","South Asia: Tsunami & Health Situation Report # 37",2005-02-18,"http://reliefweb.int/node/411632","All"
"130553","Malawi: Feature - Deepening poverty threatens households",2003-07-22,"http://reliefweb.int/node/130553","All"
"306731","Episcopal Relief & Development commemorates World Malaria Day",2009-04-25,"http://reliefweb.int/node/306731","All"
"137450","Parliamentary statement: DFID funding for low income and middle income countries",2003-11-05,"http://reliefweb.int/node/137450","All"
"430774","Chile: Floods DREF Bulletin No. MDRCL01 Update No. 2",2006-08-01,"http://reliefweb.int/node/430774","All"
"178554","Zambia: Growing concern that internal strife may split ruling party",2005-07-13,"http://reliefweb.int/node/178554","All"
"68483","Mongolia: Snowfalls Appeal No. 5/2000 (revised) Situation Report No. 6",2000-07-13,"http://reliefweb.int/node/68483","All"
"89832","Colombian FARC rebels kidnap peace commissioner",2001-11-10,"http://reliefweb.int/node/89832","All"
"491457","IITA gets US$7m approval for commercial products (COMPRO) project",2012-04-20,"http://reliefweb.int/node/491457","All"
"15162","Myanmar: WHO/WHAT/WHERE - Agriculture - Northern Rakhine State - Buthidaung, Maungdaw, Rathedaung Townships (as of 15 Dec 2009)",2009-12-15,"http://reliefweb.int/node/15162","All"
"21331","Selected Bibliography on the Global Crisis of Internal Displacement",2001-12-01,"http://reliefweb.int/node/21331","All"
"151613","International community assists Peru after intense cold and snowstorms",2004-08-04,"http://reliefweb.int/node/151613","All"
"626187","NDRRMC Update Sitrep No. 75 Effects of Typhoon ""YOLANDA""",2013-12-28,"http://reliefweb.int/node/626187","All"
"130082","Ethiopia: Student nurses sent to drought-hit south",2003-07-14,"http://reliefweb.int/node/130082","All"
"255126","Hunger's global hotspots 22 Jan 2008",2008-01-22,"http://reliefweb.int/node/255126","All"
"285142","UN agencies join rescue and relief efforts after deadly quake hits Pakistan",2008-10-29,"http://reliefweb.int/node/285142","All"
"573953","The long road home to South Sudan",2013-05-06,"http://reliefweb.int/node/573953","All"
"276349","oPt: Free Gaza boats to delay due to bad weather",2008-08-13,"http://reliefweb.int/node/276349","All"
"227722","Sudan rulers don't want peace - former Darfur rebel",2007-03-06,"http://reliefweb.int/node/227722","All"
"269973","Foreign doctors leave cyclone-hit Myanmar ",2008-06-13,"http://reliefweb.int/node/269973","All"
"400594","Five Killed in Clashes in Russia's North Caucasus 
",2011-05-09,"http://reliefweb.int/node/400594","All"
"111381","Côte d'Ivoire: Thousands flee Bouaké",2002-10-14,"http://reliefweb.int/node/111381","All"
"169014","Saving Uganda's children",2005-03-18,"http://reliefweb.int/node/169014","All"
"139854","UN sends funds and emergency teams to earthquake-ravaged Iran",2003-12-26,"http://reliefweb.int/node/139854","All"
"123721","USAID awards Iraq local governance contract",2003-04-11,"http://reliefweb.int/node/123721","All"
"353875","NIGER Perspectives sur la sécurité alimentaire Avril à Septembre 2010",2010-05-06,"http://reliefweb.int/node/353875","All"
"221509","Le huitième Secrétaire général Ban Ki-moon prête serment devant l'Assemblée générale",2006-12-14,"http://reliefweb.int/node/221509","All"
"243841","UN peacekeepers cracking down on violence in Haiti",2007-09-17,"http://reliefweb.int/node/243841","All"
"220519","UNV tsunami response Indonesia: 700 days on",2006-12-07,"http://reliefweb.int/node/220519","All"
"93447","UNICEF humanitarian action: Angola donor update 9 Jan 2002",2002-01-09,"http://reliefweb.int/node/93447","All"
"364257","OPT: Arab Partners Unit Update Issue 3, March - May 2010",2010-05-31,"http://reliefweb.int/node/364257","All"
"497386","Thousands fleeing fighting in Democratic Republic of Congo Take Refuge in Rwanda",2012-05-17,"http://reliefweb.int/node/497386","All"
"16838","Uganda: Kitgum District - Education Service Accessibility (June 2010)",2010-06-21,"http://reliefweb.int/node/16838","All"
"226813","Partners' Forum meets to support rebuilding in post-civil war Liberia",2007-02-14,"http://reliefweb.int/node/226813","All"
"121152","Press statement on Côte d'Ivoire by Security Council President",2003-03-14,"http://reliefweb.int/node/121152","All"
"560068","Mali: violents combats vendredi près de Gao entre le Mujao et des soldats",2013-03-02,"http://reliefweb.int/node/560068","All"
"189701","Mexico beefs up security to stop looting in Wilma-struck resorts",2005-10-23,"http://reliefweb.int/node/189701","All"
"146798","DR Congo holds ""last chance"" peace talks with Ituri warlords",2004-05-10,"http://reliefweb.int/node/146798","All"
"465320","Gender equality: encouraging first results of EU Gender Action Plan in developing countries",2011-12-15,"http://reliefweb.int/node/465320","All"
"613734","Swat: Dengue Fever Snapshot (7 August - 20 October 2013)",2013-11-06,"http://reliefweb.int/node/613734","All"
"328938","La crisis económica tiene un efecto devastador para las víctimas del hambre en el mundo",2009-10-14,"http://reliefweb.int/node/328938","All"
"164277","IOM Indonesia emergency relief response for Aceh: Situation report 21- 24 Jan 2005",2005-01-21,"http://reliefweb.int/node/164277","All"
"95099","Sudan: Government says Nuba cease-fire holding",2002-02-01,"http://reliefweb.int/node/95099","All"
"24829","International Food Assistance: Local and Regional Procurement Can Enhance the Efficiency of U.S. Food Aid, but Challenges May Constrain Its Implementation",2009-05-01,"http://reliefweb.int/node/24829","All"
"338819","Liberia: Medical sector gets boost...surgical wings at JFK hospital now fully functional",2009-12-30,"http://reliefweb.int/node/338819","All"
"173714","Rebuilding Afghanistan: Weekly activity update 23 Apr - 06 May 2005",2005-05-06,"http://reliefweb.int/node/173714","All"
"368858","Myanmar: Troops bolstered in Kachin as border regions flare",2010-09-23,"http://reliefweb.int/node/368858","All"
"408809","UNMEE statement on freedom of movement",2001-07-20,"http://reliefweb.int/node/408809","All"
"65562","Update on the Current Humanitarian Situation in Ethiopia 22 Jun 2000",2000-06-22,"http://reliefweb.int/node/65562","All"
"132738","WHO Liberia daily report 24 Aug 2003",2003-08-24,"http://reliefweb.int/node/132738","All"
"210422","Indonésie : Séisme de Java - Les zones rurales fortement touchées par le séisme",2006-06-06,"http://reliefweb.int/node/210422","All"
"159799","Maoists bomb Agriculture Marketing Company building in Nepalese capital",2004-12-09,"http://reliefweb.int/node/159799","All"
"461214","The Bangladesh - Food Security Bulletin: No. 6, July - Sept 2011",2011-11-24,"http://reliefweb.int/node/461214","All"
"344608","Myanmar: Monthly Recovery Update - February 2010",2010-02-08,"http://reliefweb.int/node/344608","All"
"115003","Malawi Parliament to debate World Bank emergency food loan",2002-12-10,"http://reliefweb.int/node/115003","All"
"208424","Alarming nutrition rates in north-western Nepal - severe malnutrition rates are higher than in Darfur",2006-05-09,"http://reliefweb.int/node/208424","All"
"436779","Sudan: UNJLC bulletin 42/2004",2004-12-30,"http://reliefweb.int/node/436779","All"
"623437","Iraq: Gawilan Public Health Profile Week 49, 1 -7 December 2013",2013-12-16,"http://reliefweb.int/node/623437","All"
"491632","Japan to support Ethiopia in its efforts to ensure education quality",2012-04-21,"http://reliefweb.int/node/491632","All"
"363449","Afghanistan: Marines Volunteer at Schoolhouse in Helmand Province",2010-08-09,"http://reliefweb.int/node/363449","All"
"63211","Famine in Ethiopia",2000-04-05,"http://reliefweb.int/node/63211","All"
"316791","Pakistan: Weekly Morbidity and Mortality Report - IDP hosting districts, NWFP, week 26, 20 - 26 Jun 2009",2009-06-26,"http://reliefweb.int/node/316791","All"
"492276","Viet Nam: Severe Local Storm (as of 23 Apr 2012) - Location Map",2012-04-25,"http://reliefweb.int/node/492276","All"
"177268","Between a rock and a hard place: Burmese asylum-seekers in Thailand",2005-06-21,"http://reliefweb.int/node/177268","All"
"120741","République Centrafricaine: Le commandant de la force de la CEMAC préoccupé par l'insuffisance de troupes",2003-03-05,"http://reliefweb.int/node/120741","All"
"585473","Aid worker diary: the price of gold in DRC",2013-06-27,"http://reliefweb.int/node/585473","All"
"302270","AmeriCares and International Medical Corps partner to bring lifesaving aid to Chad",2009-03-25,"http://reliefweb.int/node/302270","All"
"304251","Conference on the economic and social development of Haiti III: ""Toward a new paradigm of cooperation""",2009-04-10,"http://reliefweb.int/node/304251","All"
"172134","Some 400 Iraqi refugees yet to return home from Saudi camp",2005-04-26,"http://reliefweb.int/node/172134","All"
"405895","ONEMI declara Alerta Roja para comunas de Futrono, Lago Ranco, Río Bueno y Puyehue por aumento de actividad sísmica en Complejo Puyehue - Cordón Caulle",2011-06-05,"http://reliefweb.int/node/405895","All"
